-1	uma dica pra vida: nunca comprem notebook da dell e nem paguem garantia estendida
-1	acho que na próxima vez que for comprar um notebook eu cruzo a fronteira,mas não compro mais com a dell. que bagunça
-1	nunca comprem notebook na loja
-1	a dell me deu 1 ano de garantia grátis em cd por ter comprado um notebook , que não tem drive de cd
-1	jamais comprem notebook da fulano fulano fulano porque as máquinas estragam em menos de 1 ano e eles não consertam! #dell #lixo
-1	vejam os meus comentários a respeito da dell no reclame aqui.e vejam o que é a dell de verdade
-1	tentando recuperar meu notebook com a fulano mas ta difícil. fulano -
-1	dá uma olhada nessa reclamação contra dell computadores do brasil no fulano -
-1	como se eu fosse comprar mais alguma coisa na dell depois dessa putaria com o meu notebook
-1	você atualiza o notebook da dell para o windows 10, a tela do notebook morre, você liga para a dell e mandam você ligar para a microsoft
-1	juntando isso aos preços atuais da dell,acho que vou ficar o resto da vida com esse notebook ,porque olha
-1	fulano fulano eu fiz backup e clean install no notebook novo da minha mãe. já veio ruim de fábrica cheio daqueles programas da dell
-1	reclame aqui - dell computadores do brasil - garantia de notebook , já e a quarta vez meu deus
-1	fulano eita mano... notebook da dell é foda velho, você é um felizardo hahhaha joga na mega-sena logo kkkk
-1	aparentemente meu notebook dell é um dos poucos que simplesmente não funcionam con o microsoft wireless display adapter
-1	fui levar meu notebook pro correios agora só esperar a dell arrumar e mandar ele bom ... e sinto que vai demorar!
-1	reclame aqui - dell computadores do brasil - garantia de notebook ,já e a quarta vez meu deus
-1	olho um notebook na dell, em uma semana tava 2700, na outra 2900, hoje ta só 3400 reais
-1	to a 1 hora com a dell no telefone espero que resolva o problema do meu notebook ngm merece comprar e uma semana dps estragar
-1	esse notebook da dell nem presta essa porra ta com problema de junta!
-1	dá uma olhada nessa reclamação contra dell computadores do brasil no fulano
-1	fulano vejam bem, eu não perdoo a dell por estar com um notebook estragado. imagina se eu vou perdoar vocês por estragarem a netflix
-1	dá uma olhada nessa reclamação que eu fiz contra dell computadores do brasil no fulano
-1	depois de 56 (!) minutos com o suporte telefônico da dell, terei que enviar o notebook para a assistência
-1	fulano fulano fulano inspiron 15 5547 defeito ! vejam o video !!! cuidado!
-1	meu notebook ta muito lento to me sentindo enganado pela dell porque me fizeram uma propaganda enorme dessa coisa
-1	dell ajuda por isso não indico a ninguém comprar um dell. estou com notebook encalhado???? fica a dica, dell ajuda fulano
-1	vou conversar amanhã com o cara da dell pra ver se o tecnico vai vir aqui em casa tentar arrumar o problema do notebook
-1	dá uma olhada nessa reclamação contra dell computadores do brasil no fulano
-1	td o que eu queria era o meu notebook sério nunca te pedi nada dell
-1	sério dell,eu tenho que decorar a quantidade de apitos que o retardado do meu notebook da?
-1	agradeço quem quiser me dar um notebook novo mas dessa vez não quero dell,péssimo atendimento pós venda e a bateria uma bosta
-1	vou instalar o windows 10 no notebook da minha mãe mas vou deixar ele formatar. eu quero matar esses programinhas da dell que vêm junto
-1	a dell ta conseguindo meu ódio com esse notebook ,tenho um problema atrás do outro com esse modelo de notebook
-1	fulano deixo aqui a minha insatisfação com a dell e com o técnico que fez atendimento na garantia de meu notebook
-1	fulano fulano amigos estou com o segundo notebook defeituoso vendido pela dell a mais de 10 dias tentando contato e sou enrolado
-1	frustado com o atendimento da dell. notebook com 3 semanas deu problema no carregador. suporte ficou de me enviar um novo... fulano
-1	dell diagnostic hard drive error code ..  :'( tentando resolver um problema,eu achei outro .. notebook e eu super 'alinhados'  :-/
-1	linha de pc's / not's dell vostro não presta,haja paciência pra instalar os drivers  =x
-1	paguei 2800 em um notebook dell que só durou um ano e meio
-1	problemas com eletrônicos só aparecem depois que acaba a garantia,incrível! #dell #notebook
-1	serio que vocês nunca precisem desmontar um notebook da dell,acabou de desmontar o meu aqui e posso disse que foi foda!
-1	reclame aqui - dell computadores do brasil - dell inspiron 14 sem solução de problemas
-1	primeiro susto - resolvido - dell: o notebook está carregado, mas não liga
-1	meu notebook dá dando umas travada monstruosa. mas não consigo atualizar os hardwares pelo site da dell,sos
-1	fulano hara desculpe incomoda-lo... tenho um notebook dell e após atualizar para windows 10 ele simplesmente não liga!! modelo inspiron 14z
-1	cara,as baterias dos notebook da dell não presta,já tive dois,e os dois são ruins
-1	dá uma olhada nessa reclamação contra dell computadores do brasil no fulano
-1	e esse rápido acesso da dell que tu desinstala do notebook e quando vê já ta lá instalado de novo
-1	a fulano me vendeu um notebook com defeito. a troca deve estar vindo da china. a pé. já são quase 30 dias. e aí? fulano
-1	to iradoo!
-1	preciso do meu notebook funcionando fulano
-1	por que notebook da dell e tão ruim?
-1	reclamação contra dell fulano
-1	fulano fulano gente vocês nunca viram comercial da dell não ultrabook é um notebook super lixo odiei
-1	reclame aqui - dell computadores do brasil - dell erra na entrega e não cumpre prazo
-1	getting #spam from fulano but its notebook in english,so i cant read it. está procurando acessórios básicos? #wtf #dellspam
-1	uma dor de cabeça chamada fulano #putodavida #revotado #serviçopéssimo #reclamação fulano
-1	nada pior que acordar ligar o notebook e descobrir que queimou a placa wifi #dell fulano
-1	resoluções para a vida: nunca comprar notebook dell ou celular samsung
-1	descaso total da fulano fulano fulano comigo. paguei o notebook a vista! e ainda solicitei assistência residencial. nunca vieram
-1	caraca o meu notebook tá dando trabalho para o tecnico. isso porque é dell
-1	tenho que mandar outro email pra dell porque meu notebook ta com problema no lcd de novo que inferno
-1	eu simplesmente não encontro no site da dell como faço pra solicitar o suporte deles,porque meu notebook tá com problema numa das portas usb dele
-1	fulano a atualização do meu windows 8 para o 10 (originais) novamente danificou meu note. quem pagará o reparo de r$ 700 da dell?
-1	reiniciando teu cu notebook dell filho da puta!
-1	continuo na batalha: fulano,esteja certa de que não desistirei até acordo satisfatório ou a justiça ser feita!
-1	me lembrem de nunca comprar notebook da dell
-1	comprei meu notebook da dell fez 1 ano e já tá um lixo eu quero meus direitos
-1	e esse notebook dell xps 13 que é tipo um macbook com windows ein
-1	me dá vontade de chorar quando eu percebo que o note. novinho que eu comprei da fulano esta com problemas desde a 2ª sem. e eles n fazem nada
-1	e eeeu papapapará gostava tanto de você... dell computadores do brasil no fulano -
-1	dá uma olhada nessa reclamação que eu fiz contra dell computadores do brasil no fulano
-1	nunca mais vou comprar notebook da #dell novamente
-1	essa novela precisa ter fim! fulano -
-1	to na pira de arrancar este adesivo da dell do notebook,afinal ta colando na minha mão esta merda
-1	esse notebook da dell é uma verdadeira merda
-1	atualizar driver do chipset e bios pra tudo funcionar!! bosta de dell!! vou comprar um notebook novo e foda-se!
-1	meu notebook era tao bonitinho quando chegou..agora ta uma desgraça pra remover todos esses virus. quase mandando pra dell
-1	alo dell vamo cooperar que esse notebook nao tem nem 1 ano pra dar problema me ajuda
-1	meu notebook da dell, chegou a uma semana aqui em casa. notebook novo,vindo da loja e já ta dando defeito... o marca bosta essa dell
-1	o meu notebook da dell mal chegou e eu já tô quase arrependido da compra... pelas reclamações que vi ele só vai me dar dor de cabeça
-1	porque os notebook da dell com intel i5 é tão caro? ai que injusto,o i7 então nem se fala
-1	comprei uma bateria nova pro meu pc, porque não to afim de comprar notebook novo. mas esse site da dell é insuportável!
-1	seus notebook é uma bosta fulano
-1	como se não bastasse meu celular estar estragado estragou o notebook também
-1	já está bom de "zica" tecnológica: dell c placa mãe em curto",acer c processador queimado,notebook novo travado pra w7,2 pendrives queimados
-1	troquei 6 por meia dúzia, achei que trocando meu notebook da dell pelo da samsung ia me livrar de problemas. porra nenhuma
-1	qual é o problema da dell com o windows 8.1,hein? já é o segundo notebook que vejo que dá problema com essa versão
-1	comprei um notebook dell,não me entregaram. decidi levar o antigo para o conserto; economizei r$ 1.600,00 [grato pela ineficiência,dell]
-1	atualizar o notebook e ele travar de vez. só comigo ? #dell #windows8 #help
-1	dell me vende um notebook com problemas e fica criando dificuldades pra resolver o problema. nunca mais
-1	desculpas eu já ouvi demais quero solução!!!
-1	seguinte: tenho um notebook dell n4030 que está dando problema,comprei uma fonte nova, ela funciona. porém, eu
-1	atendimento porco! não recomendo a dell pra ninguém mais! decepcionado! precisando urgente do meu note,comprometendo meu trabalho...putz
-1	fulano esse foi o meu primeiro notebook dell. não foi uma experiência muito boa. tenho um outro acer que nunca deu problema
-1	o mesmo notebook da dell a dois meses custava 2599,00 hoje esta 2.899,00 e olha que é um i5. a dell ta sentando o sarrafo
-1	dá uma olhada nessa reclamação contra dell computadores do brasil no fulano -
-1	vai tomar no cu dell do caralho nao aguento mais. segundo notebook com problema no mousepad
-1	não atualizem seus notebook s dell para o windows 10. queima a placa-mãe!!!
-1	essa merda de notebook novinho já ta dando problema. #dell :/
-1	foi só comprar a memoria pro macbook e que meu notebook da dell largou mão e parou de trabalhar
-1	som do notebook da dell é baixinho,vou ter que largar uma gambiarra e conectar no som
-1	a maldita dell não me deixa carregar a bateria do note. e amanhã não vai ter luz
-1	#dell  #lixo tô pensando seriamente em devolver meu notebook ... ele ainda não chegou,mas pelo que vejo
-1	nunca,mas jamais comprem notebook da fulano fulano fulano porque as máquinas estragam em menos de 1 ano e eles não consertam!
-1	pelo amor e deus! como a dell faz notebook tão ruim. sos ! mac
-1	um caso lamentável de uma suposta ""grande empresa"" que lança no mercado um produto com incompatibilidades na..."
-1	comprei um notebook dell pouco antes de eu viajar de férias. voltei domingo agora. o bicho já ta dando problemas. porque,sabe?
-1	fulano é sim! eu tenho um notebook dell e sempre da problema no wifi
-1	alo dell o notebook da fulano ta com problema o modelo é esse aqui
-1	fulano fulano parabéns pelo péssimo serviço de hell desk! etiqueta no fundo do notebook apaga,a culpa é do cliente que comprou com vocês?
-1	e todo mundo sabe que o que mais mata notebook é temperatura. os da hp e dell esquentam até o processador forçar desligamento
-1	dell,pior touchpad,pior conexão pra fone,pior processador ever. que raiva desse note
-1	tô há 35 minutos conversando por telefone com o técnico da dell, procurando uma solução para o meu finado notebook
-1	preciso formatar meu notebook urgente. mas essa dell é tão chata que se eu tentar formatar é capaz de ferrar ele mais ainda ?
-1	a tela do meu notebook dell é muito apagada e sem brilho, quando jogo na tv ou no mac parece outra coisa
-1	fulano há 1 ano sem a placa mãe dell vostro 1710 notebook parado dell nada
-1	em 2009 compramos um notebook dell por r$2.500, 6 anos depois não vale nem 10% ou r$250
-1	tu olha o preço do macbook e pensa: vou ver o preço do dell... você ve os preços do dell: - eu mesmo arrumo meu notebook
-1	a dell não está agindo de boa fé comigo. renoveu o suporte do meu notebook até 2016 e depois de 30 meses exigem nf pra me atender
-1	notebook dell inspiration 15 é uma roubada, não comprem
-1	odeio meu notebook dell. uma bosta
-1	sugiro que não comprem notebook ou qualquer outro aparelhos da dell... nada funciona,só problemas
-1	aí não sei se fodo com a dell ou se com o pessoal que formatou meu notebook , socorro
-1	notebook dell, por que tão complicado?
-1	reclame aqui - dell computadores do brasil - tablet dell venue 7 3741-a10 - não comprem de jeito
-1	aguardando até agora a assistência 24h da dell. você tem seus prazos para cumprir e seu notebook parado até quando?
-1	meu notebook deu pau e a dell quis cobrar quase 1k pra arrumar (sem dizer qual que é o problema)
-1	vou ter que chamar o técnico da dell porque a tela do notebook ta com uma pintinha aff e eu que ja comprei logo a dell porque pensei nao dar problema
-1	a tela do meu celular é bem melhor que o do meu notebook da dell,que horrível
-1	gente,a dell demora montar um notebook ein! #oh
-1	fulano como a dell sabe que eu sou fresco e sempre vacila pra entregar meu note?
-1	sem condições com esse notebook ,amanhã vou ligar pra assistência da dell vir aqui e arrumar esta bela bosta
-1	perguntar não ofende: por quê a dell vende um notebook com sistema operacional ubuntu mais caro que o mesmo notebook com windows 8.1?
-1	na verdade tudo isso é culpa da dell, porque se a dell fizesse uma bateria decente que não viciasse tão facilmente, o notebook teria ido
-1	ahh cacete, dell porque tu me manda mensagem dizendo pra verificar status do meu notebook , se não muda nada?
-1	fulano agora é procom! nem reclame aqui adianta mais! fiquem atentos! não comprem! não presta! 3 dias esperando retorno,sem solução! 0 retweet 0 curtiu
-1	reclame aqui - dell computadores do brasil - item faltante - compra realizada em 09/02/2015 e
-1	então né,eu cliquei num negócio e o notebook reiniciou(ele tava fazendo algo de backup dell sei lá) aí né,foda
-1	dell é o notebook que tem estrutura mais fraca, sempre quebra
-1	tenho um notebook de última geração, porém não tem entrada pra cd, essa dell pensa que sou rica pra ficar comprando programas caríssimos?
-1	no chat online da dell eu: acusa erro no hard drive,não acessa o windows. técnico: ok. você está no chat através do notebook ?
-1	ativei as configurações do touchped do notebook . fui pra casa da namorada, voltei, me deitei e agora que apareceu a janela de opções. #dell
-1	compre um notebook da dell e de brinde ganhe 24 meses de dor de cabeça ou sofra com ela até trocar de notebook :)
-1	maior arrependimento da minha vida foi ter dado 4 mil reais no notebook da dell. jesus, tira essa raiva de mim!!!!
-1	2 anos após ter comprado o notebook , eu encontrei a entrada pra cartão de memória. culpa da dell
-1	sonho: notebook da dell realidade: pc quebrado
-1	minha colega comprou o mesmo modelo de notebook da dell que eu e praticamente no mesmo período, eles vivem travando
-1	lá vai o role de ligar para a dell.... aí falar o código lá... falar que tenho garantia... falar que não o notebook está sem carga alguma
-1	se tem uma coisa que tenho certeza na vida é: se sua intenção com um notebook é conectar-se a internet via wifi, nao compre dell
-1	a dell cobrando a pequena quantia de r$ 1.500,00 pra trocar o lcd do meu note.  existem várias formas de assalto,realmente
-1	reclame aqui - dell computadores do brasil - trinca no touch screen display (tela) no notebook
-1	fulano, por nada! eu tenho um notebook dell e já passei muita dor de cabeça com ele
-1	receptor wifi em notebook em geral é bem ruim. meu celular aqui ao lado nem sente as pequenas quedas de conexão, o dell fica 3 minutos off
-1	gente nunca comprem notebook dell as bateria nao duram 2 anos serio
-1	vai tomar no cú! só passo raiva com essa merda de notebook !!! jamais comprem produtos dell, é uma bosta!
-1	fulano fulano fulano essa porcaria da fulano tem esse trambique mesmo,não poupe o couro deles
-1	sobre o touch do mouse do meu novo notebook dell,to achando uma droga,mas pelo custo benefício,não posso reclamar acho
-1	notebook da dell é ruim
-1	nunca mais compro notebook da dell meu core 2 duos era mais rápido que esse i5
-1	precisa de suporte fulano no fim de semana? esqueça! problemas no carregador do notebook novo na sexta noite,esperando ate 5 dias pra repor!
-1	fulano já tive dell e ainda tenho um notebook hp.  fuja da dell e da hp. lenovo é o melhor em tudo
-1	dá uma olhada nessa reclamação contra fulano computadores do brasil no fulano -
-1	eu tenho um notebook antigo da hp aque que tem uns 5 anos e ainda funciona beleza. só é lento. aí o dell me apronta uma dessas
-1	terceiro notebook dell que da problema com internet wi fi aqui em casa
-1	eu tava com um probleminha no note.consultor da dell falou que não tinha nada de errado.agora o sistema está sendo restaurado por erro dele
-1	reclame aqui - dell computadores do brasil - inspiron 14z 5423 parou de funcionar após
-1	nunca pensei que seria tão difícil,configurar um notebook da dell
-1	como a assistencia tecnica sumiu com meu notebook ,preciso de um novo,alguem indica uma marca boa sem ser dell ou apple (caro demais p mim)
-1	eu odeio esse notebook da dell, mano, vocês não tem noção
-1	eu comprei um notebook da fulano e mano oficialmente pior bosta que eu ja comprei na vida
-1	eu burra,paguei quase 300 reais num antivirus que veio notebook dell,fulano que nao serve muito e ainda tem uma maldita listra notebook
-1	achava que a dell era a menos pior dentre os notebook s e to a um ano quebrando a cara com o notebook indo e voltando da assistência
-1	por isso não gosto desse notebook dell, vive pedindo atualização e demora um ano pra ligar depois
-1	grande decepção com o suporte da #dell #reclameaqui já!!!
-1	o notebook que eu acho super lindo da dell veio para o brasil. mas: sem placa de vídeo e com configurações ruins
-1	estou extremamente insatisfeita com meu notebook dell novo, pois a placa wireless intel 7260 conectividade ruim dell
-1	a dell me manda dois emails por dia,acho que eles sabem que meu notebook não tá mais funcionando e tão tentando me vender outro!
-1	quando eu precisar trocar de notebook , sem dúvidas não comprarei dell
-1	caralho a dell demora muito pra entregar um notebook
-1	vejo muito chupa rola de dell porque,não é porque teu notebook e da dell que ele vai ser bom. ainda mais inspiron,malz ai
-1	talvez trocar o notebook não tenha sido uma boa opção. rodava de boa no hp,agora no dell... dells me livre!
-1	não estou conseguindo assistir séries no note,dell seus inuteis
-1	e a porra do notebook da #dell estragou de novo! #delllixo #notedell #lixo
-1	notebook dell não compro mais. toda hora abrem avisos de atualização/recuperação do sistema que nao servem pra nada. querem ganhar vendendo inutilidade
-1	30 dias para entregar um notebook dell?
-1	fulano caso parecido com a dell e a frente do leitor de dvd do notebook . queriam que enviasse pra lá,pagando preço de um drive completo
-1	já tinha até esquecido do meu notebook , ai recebo um email da dell informando que só hoje que começaram a arrumar ele
-1	fulano ah sim... experimenta comprar um notebook dell,hp,sony... você morre louco com tanto programa acessório chato
-1	nunca vi um notebook recém novo travar como esse, velho. ainda é da dell
-1	além de vir com baidu,o notebook da fulano ainda tem seu próprio e horrível sistema de recuperação de fabrica. #fail fulano
-1	dá pra comprar outro notebook novo com o valor deste reparo da dell
-1	dell, pelo amor de deus troca o meu notebook , vai ser a terceira vez que eu preciso chamar a assistência técnica
-1	sem notebook de novo... parece brincadeira de mau gosto. #dell
-1	absolutamente irritado com a fulano . devolveram o notebook nem a manutenção e às vésperas do vecto da garantia
-1	notebook dell continua dando defeito
-1	pela terceira vez em 9 meses,recebo a visita do suporte da #dell e fico,mais uma vez,sem note. nada resolvido. obrigada,fulano
-1	fulano aham!! e eu dei azar acho meu notebook vive dando problema e a assistência da dell fala que é "incompatibilidade com windows 8.1"
-1	notebook dell muito ruim cores ruim brilho de tela ruim
-1	é muito fácil achar reclamações da fulano fulano fulano não quer ter dor de cabeça,pesquise!
-1	eu falo que a dell não sabe fazer carregador de notebook que dure mais que o mesmo porque na 1ª vez que deu problema eu vi que muitas
-1	alguém tem notebook dell e sabe como tirar essa caralha desse brilho adaptavel?
-1	proximo notebook vou comprar da acer porque dell nunca mais que coisa horrivel
-1	1 hora e 46 min foi o tempo que fiquei no telefone com o cara da dell pra dar um jeito nesse note,o ruim só foi o fato de não ter viva voz nessa porra
-1	adeus notebook dell escroto cheio de vírus descanse em paz
-1	torcendo pra dell agilizar logo minha situação pra eu não precisar ir no procon. tanto problema só porque eu quis comprar um notebook bom
-1	daora ,ia mandar um email pra dell, perguntando se meu notebook vai funcionar de boa com o windows 10. minha garantia expirou
-1	meu notebook ficou zoado desde que a dell instalou o programa de reconhecer rosto. que ódio!
-1	reclame aqui - dell computadores do brasil - equipamento com problema desde a aquisição
-1	reclame aqui - dell computadores do brasil - vende a garantia e não conserta o equipamento
-1	dois anos de notebook estragado e agora nem o reembolso e feito.espero que a dell se retrate e faça a coisa certa.vou ficar aguardando
-1	dell nega atendimento aos seus clientes no reclame aqui - ra notícias
-1	eu nao aguento mais entrar em contato com a dell brasil pra resolver um problema no meu notebook . toda vez me dão
-1	reclame aqui - dell computadores do brasil - dell nega atendimento em garantia
-1	cara,a tela do notebook dell é ruim demais. só dá pra enxergar em um ângulo específico
-1	a diferença entre pedir pra dell trocar a tela do meu notebook e eu mesmo comprar uma pelo mercado livre e trocar é mais ou menos mil reais
-1	você acha que a fulano tem notebook s com uma qualidade superior,você está enganado. #dell #delllixo #nãocompredell
-1	fulano fulano meu notebook tá com 2 anos e 2 meses. já tá caducando. que é isso!!! praticamente só uso word e internet!
-1	tenho um notebook dell e não consigo desativar o microfone interno. quero usar fone externo e não consigo. suporte não consegue,como pode?
-1	fulano fulano fulano  não comprem !!! tela com manhas e super aquecimento do teclado
-1	meu notebook dell não está entrando no windows. e olha que eu desliguei ele certinho ontem a noite
-1	a pessoa compra um notebook e é obrigado a comprar um mouse... porque o touchpad não vale bosta! cce >>>>>>> dell
-1	fulano ultrabook dá dell não ultrabook,é um monstro como todo notebook . viaja no peso nas especificações! eu curti um da lg
-1	aff que bosta,meu notebook ta travando muito,de um jeito anormal... porra é um dell! não era pra ser assim!
-1	reclame aqui - dell computadores do brasil - nao carrega mesmo com o led da fonte aceso e verde
-1	alegria com o windows 10 no note. vejo que nao consigo mais ajustar o brilho da tela. descubro que a dell não atualizou todos drivers. fodeu
-1	acho que nessa semana o técnico da dell vem buscar o notebook e trazer o novo, ainda bem
-1	tô há quatro meses com o notebook da dell e os graves do som já estão fodidos
-1	podem ter certeza: eu nunca mais vou comprar um dell. nem que seja o último notebook da face da terra
-1	nada do notebook que eu comprei chegar,e ninguém da dell me dá uma explicação convincente,portanto: compra cancelada
-1	fulano, o problema é que o meu notebook que estragou era justamente da dell. não tive uma experiência boa com ela
-1	no momento estou eu na fila do suporte técnico online da dell pois o microfone do meu notebook aparentemente não existe
-1	meu notebook dell tem uma porcaria de um programa em segundo plano de recovery que não tem nenhuma opção de desativar
-1	ainda tô processando o que a dell queria me cobrar pra trocar a tela do meu note!! sério!! tô chocada!!
-1	a fulano se recusou a prestar suporte do meu notebook pois atualizei meu windows para o 10 com a chave fornecida por eles mesmos! que escroto!
-1	fulano r$ 1.603,29 pra trocar só a tela de um notebook que custou r$ 2399? cês tão de zoeira?
-1	aí eu procuro uma bateria nova pro meu notebook de 5 aninhos e o fabricante não vende mais. #comofaz dell???
-1	dá uma olhada nessa reclamação contra fulano computadores do brasil no fulano
-1	dúvida existencial: vou parar de reclamar da dell quando eles arrumarem meu notebook ?
-1	desinstalei a atualização dell e o notebook parou de travar... olha a dell querendo travar meu notebook com atualizações de touchpad
-1	nao sei se é a dell ou se é o windows 8, mas meu notebook atualizou e simplesmente não liga
-1	madrugada ajeitando um notebook . depois de tanto quebrar a cabeça,finalmente arrumei a solução pro ubuntu 64 bits no notebook dell
-1	cara não é porque tenho notebook da dell que quero propaganinha de 5 em 5 min no meu pc obrigada de nada
-1	reclame aqui - dell computadores do brasil - não consigo pedir para conserto de notebook
-1	dá uma olhada nessa reclamação contra dell computadores do brasil no fulano -
-1	ok, formatei o notebook com o sistema da própria dell e a webcam continua sem funcionar. aí vou pro linux e ela funciona
-1	mds um notebook da dell 2.900 com esse dinheiro junto mais um pouco e compro um mac
-1	dá uma olhada nessa reclamação contra dell computadores do brasil no fulano
-1	notebook da dell é um lixo
