-1	pelo menos vou vender finalmente meu notebook dell,não quero nem cheiro dessa marca perto de mim nunca mais
-1	se vocês forem comprar um notebook , fujam da dell, dica de amiguinho
-1	eu só quero a porra do meu notebook , pelo amor de deus dell, libera essa merda logo
-1	quem disse pra dell que isso que eles fazem é um notebook ? parece mais uma sanduicheira, vive travando essa porra
-1	defeito lcd notebook dell inspiron 14r (5437,mid 2013) - defective dell notebook (jul2015)
-1	a desculpa agora do suporte fulano fulano fulano é que tentaram contato e não conseguiram,estão de brincadeira! fulano
-1	adivinhem? meu notebook deu pau no windows e agora vou ter que esperar a dell me enviar um cd do windows ate sexta
-1	esperando deitado por uma promoção da fulano,para fechar negócio... to vendo que meu notebook não será #dell
-1	comprei um notebook da dell. rapaz, se arrependimento matasse, eu tava já em decomposição. puta que pariu, que novela
-1	entro no site da dell com a intenção de comprar o notebook mais barato, aí eles fazem a comparação com os mais caros
-1	dell - o barato que sai caro fulano
-1	nas opções do laptop mag indicaram o dell xps 13. aquele notebook é horroroso em questões de design
-1	fulano dell desrespeita consumidor,conclusão: compro o notebook direto da dell e mesmo depois da garantia sou obrigado a manter sua mais
-1	o fulano é a última esperança. comprei notebook com office 2013. a dell não mandou chave do produto e ainda me diz pra resolver com a microsoft
-1	cara, eu e o google manjamos mais de arrumar meu notebook do que o suporte da dell
-1	notebook de 3 mil reais dar problema para conectar wi-fi
-1	a pior entrega que já tive foi de um notebook da dell como era customizado o prazo era de 30 dias,chegou no 30° dia
-1	que saudades do meu notebook da hp, esse dell é uma bosta, que sacoooooo
-1	fulano fulano fulano o problema foi dia 05.03,fiz todos os procedimentos,pagamento e só hoje irão agendar a visita do técnico
-1	instalo uma atualização da dell e o meu notebook começa a travar inteiro
-1	meu notebook dell fica conectado ao carregador,mas não carrega. já é a segunda vez que isso acontece em menos de
-1	fulano meu monitor de notebook da dell novo está com uma linha clara e horizontal
-1	recebo tanto e-mail da dell que qdo for comprar outro note,escolherei qualquer outra marca! #cansei #peguei_nojo
-1	a dell me coloca 16gb de ram e uma hd de apenas 5400rpm. aí essa merda de notebook parece que é valvulado. preciso comprar um ssd urgente
-1	e o suporte da dell que ligou pro numero errado,a pessoa que atendeu disse que tava ok o notebook e a dell encerrou o meu chamado?
-1	ainda não consigo navegar na internet no meu notebook dell atualização de drivers e troca de placa não resolveu o problema!
-1	comprei uma bateria da fulano para notebook . veio errada e danificada e a dell não troca pois já se passaram 7 dias apos o recebimento. foda!
-1	a tecla delete do meu notebook dell tá com defeito. quando não funciona fica pressionando pra excluir tudo o que eu seleciono. e agora?
-1	dell alguém consegue me explicar por que eu não consigo nem aumentar e nem diminuir o brilho do meu notebook ? obrigado!!
-1	notebook #dell sem teclado abnt2 desanima
-1	meu notebook não ta ligando fulano ?
-1	que merda de notebook esse dell de bosta
-1	comprei um notebook da dell que não vale. ligo na assistência,mando email e eles não retornam .. só estou falando isso para alerta-los
-1	nunca mais compro notebook da dell
-1	a velocidade da ""troca avançada"" da dell (substituição em garantia) é inversamente proporcional à pressa que eles..."
-1	fulano agora que fui ver o ranking da dell no reclameaqui,só 29% das reclamações voltariam a fazer negócio,acho que entrei em uma furada
-1	notebook dell, um monstro de performance, um bosta pra sinal wi-fi
-1	não!!! dell,eu não quero comprar notebook . comprei um novinho em folha no fim do ano passado
-1	quero trocar meu notebook ,não gostei desse da dell quero um hp de novo
-1	a dor de cabeça que o meu notebook dell nunca deu o meu fulano que foi muito mais caro tá dando. péssimo pós venda
-1	queria poder devolver essa bomba de notebook dell e pegar um acer. me arrependo amargamente
-1	vou comprar um notebook da hp. a dell é uma merda,tenho um ódio fodido dessa empresa fdp
-1	pra quem tem notebook fulano  se prepare: quando sua máquina fizer mais de 5 anos,a dell te vira as costas,só te resta jogar fora! #chatiada
-1	fulano meu notebook não liga mais!! trava na tela de inicialização ""dell"" e não funciona mais",oque eu faço?!
-1	se forem comprar algum computador ou notebook ,não comprem na dell. preço alto que não compensa e suporte técnico terrível
-1	e esse meu notebook novo,i7 quinta geracao,ssd e a porra da webcam nao funciona (y) que beleza hein dell
-1	o praise-the-lord amazing wonderful ultra mega power notebook dell® foi pra fita em 2 semanas. nem isso,eu acho
-1	e os programa da dell que vem instalado no notebook  e fica travando o audio
-1	dá uma olhada nessa reclamação que eu fiz contra dell computadores do brasil no fulano
-1	tu paga 3 pau em um notebook da dell e essa bixiga tá mais lenta que o meu antigo pc com celeron,wtf?
-1	notebook da fulano inutilizável após update para o windows 10 da fulano ajudem a compartilhar quero uma solução!
-1	essa dell ta de sacanagem comigo, cada hora me aparece um problema diferente nesse notebook ¬¬
-1	tive problema semelhante com um notebook da dell. a tralha de 500mb de drivers e aplicacoes de suporte do leitor de impressão digital nao
-1	ai meu notebook é o um dell, que não tem um powerpoint, lixo
-1	meu notebook da dell,chegou a uma semana aqui em casa.  notebook novo,vindo da loja e já ta dando defeito... oh marca bosta essa dell
-1	aí que notebook lixo dell bosta
-1	nao de dell
-1	notebook não tem nem 2 meses de uso,é já ta pipocando e olha que é da dell
-1	cara da dell ta aqui trocando as peças do note(de novo). espero que resolva dessa vez
-1	primeira grande coisa ruim do meu notebook novo: a dell não oferece driver pra webcam, ela só funciona com o driver genérico do windows
-1	fulano meu notebook dell está dando 8 bips seguidos muito altos a todo momento,ele funciona perfeitmente mas acho que pode ser algum problema
-1	será que a dell me dá um notebook novo porque o meu do nada agora desliga sozinho mesmo com 99% de bateria
-1	fulano vem logo arrumar o meu notebook por favor
-1	fulano fulano estou com um chamado aberto na fulano desde de fevereiro e aguardando terceira visita há 8 dias.etiqueta fulano fkg8g22
-1	fulano o foda é que o ultrabook que eu vi da dell aqui,que vale a pena comprar,custa o dobro de um notebook top de linha
-1	meu notebook atual veio com antivirus mcafee. meu deus como é ruim! por que a dell trocou a norton por eles?
